{
  "schema_version": "alpha-forecast-v1",
  "batch_id": "synthetic-batch-1",
  "attempt_id": "synthetic-attempt-1",
  "input_manifest_sha256": "e2d0b8c6729ce796db13139143458ed5e0d2613238b03e80a8418a5378bb0e51",
  "feature_schema_sha256": "e87dcc3f795351e6aaa3e6c4032553fd8db87c48bdde85f7496e573c40c5dc18",
  "model": {
    "artifact_sha256": "aa5678202dae1f860ed5a623362b6702f300fbc17f92b965ea86746980090a76",
    "training_manifest_sha256": "3f35f2a1323eb9dcee10fd617465ac5106333bd1b9dc7db1943961530fc9fa09",
    "config_sha256": "038fc30cfb385c4bfc79217f223db03b314edd759a632e56c066bd4847af734d",
    "code_sha256": "7bc38541c0aa6f997f984f4066271c3c6f0da5fc32c9f57ed0dd72e3feaff7cf",
    "runtime_sha256": "fcc0ff21834452a9976abbdcd0c408c6f8a244cd6b3b9ffbf2ba2044d434685e",
    "seed": 0
  },
  "score_semantics": {
    "kind": "expected_excess_return",
    "unit": "decimal_return",
    "direction": "higher_is_better",
    "target": {
      "kind": "benchmark_excess_return",
      "unit": "decimal_return",
      "benchmark_listing_id": "9007199254740995",
      "entry_policy": "next_session_open",
      "exit_policy": "horizon_close",
      "price_basis": "total_return_adjusted",
      "definition_sha256": "bb746f2a96e2f53e31317161683c2e4d770404281fc1fed2ed4e6ef04acc39a4"
    }
  },
  "generated_at": "2025-03-07T21:00:03Z",
  "results": [
    {
      "row_id": "jan-0",
      "listing_id": "101",
      "as_of_timestamp": "2025-01-03T21:00:00Z",
      "horizon": {
        "label": "1m",
        "policy": "xnys-calendar-months-next-open-v1",
        "calendar_sha256": "787b5dc9146bbcfb410215bf1e103d7e645f3877a2d92248faa46ed776b65034",
        "decision_session": "2025-01-03",
        "entry_session": "2025-01-06",
        "entry_at": "2025-01-06T14:30:00Z",
        "end_session": "2025-02-03",
        "end_at": "2025-02-03T21:00:00Z"
      },
      "score": {
        "status": "available",
        "value": "0"
      }
    },
    {
      "row_id": "jan-1",
      "listing_id": "9007199254740993",
      "as_of_timestamp": "2025-01-03T21:00:00Z",
      "horizon": {
        "label": "1m",
        "policy": "xnys-calendar-months-next-open-v1",
        "calendar_sha256": "787b5dc9146bbcfb410215bf1e103d7e645f3877a2d92248faa46ed776b65034",
        "decision_session": "2025-01-03",
        "entry_session": "2025-01-06",
        "entry_at": "2025-01-06T14:30:00Z",
        "end_session": "2025-02-03",
        "end_at": "2025-02-03T21:00:00Z"
      },
      "score": {
        "status": "unavailable",
        "reason": "missing_features"
      }
    },
    {
      "row_id": "mar-0",
      "listing_id": "101",
      "as_of_timestamp": "2025-03-07T21:00:00Z",
      "horizon": {
        "label": "1m",
        "policy": "xnys-calendar-months-next-open-v1",
        "calendar_sha256": "787b5dc9146bbcfb410215bf1e103d7e645f3877a2d92248faa46ed776b65034",
        "decision_session": "2025-03-07",
        "entry_session": "2025-03-10",
        "entry_at": "2025-03-10T13:30:00Z",
        "end_session": "2025-04-07",
        "end_at": "2025-04-07T20:00:00Z"
      },
      "score": {
        "status": "available",
        "value": "0"
      }
    },
    {
      "row_id": "mar-1",
      "listing_id": "9007199254740993",
      "as_of_timestamp": "2025-03-07T21:00:00Z",
      "horizon": {
        "label": "1m",
        "policy": "xnys-calendar-months-next-open-v1",
        "calendar_sha256": "787b5dc9146bbcfb410215bf1e103d7e645f3877a2d92248faa46ed776b65034",
        "decision_session": "2025-03-07",
        "entry_session": "2025-03-10",
        "entry_at": "2025-03-10T13:30:00Z",
        "end_session": "2025-04-07",
        "end_at": "2025-04-07T20:00:00Z"
      },
      "score": {
        "status": "unavailable",
        "reason": "missing_features"
      }
    }
  ],
  "forecast_sha256": "1caa9dfc5e5cf1823b77ba0b20cd2d84b8c1d126fbd1a74f078f9afe76915ba1"
}
